{
  "slug": "example-12tet",
  "title": "Example 12-TET",
  "description": "A minimal 12-tone equal temperament example pack.",
  "author": "Tenney Community",
  "authorUrl": "https://example.com",
  "license": "CC0-1.0",
  "tags": [
    "equal-temperament",
    "example"
  ],
  "defaults": {
    "rootHz": 440,
    "primeLimit": 13
  },
  "inputs": {
    "scala": "sources/12tet.scl"
  },
  "createdAt": "2026-01-17T08:24:43Z",
  "updatedAt": "2026-01-17T08:17:15Z"
}
